{
  "private_contract": "rubizh-pim-private-costs",
  "version": 1,
  "currency": "UAH",
  "generated_at": "2026-10-09T12:00:00.000Z",
  "revision": "e4a33540cdce11a8",
  "costs": [
    {
      "sku": "RUB-F0001",
      "supplier_payout_minor": 180000
    },
    {
      "sku": "RUB-F0002",
      "supplier_payout_minor": 180000
    },
    {
      "sku": "RUB-F0003",
      "supplier_payout_minor": 180000
    },
    {
      "sku": "RUB-F0004",
      "supplier_payout_minor": 180000
    },
    {
      "sku": "RUB-F0010",
      "supplier_payout_minor": 120000
    },
    {
      "sku": "RUB-F0020",
      "supplier_payout_minor": 90000
    },
    {
      "sku": "RUB-F0021",
      "supplier_payout_minor": 90000
    },
    {
      "sku": "RUB-F0030",
      "supplier_payout_minor": 70000
    }
  ]
}
